ateco,descrizione,cardinalita
69.20.11,"Servizi forniti da dottori commercialisti",21
26.30.29,"Fabbricazione di altri apparecchi elettrici ed elettronici per telecomunicazioni",16
71.12.20,"Servizi di progettazione di ingegneria integrata",15
27.90.09,"Fabbricazione di altre apparecchiature elettriche nca",14
74.90.21,"Consulenza sulla sicurezza ed igiene dei posti di lavoro",12
69.10.10,"Attivit degli studi legali",12
71.12.10,"Attivit degli studi di ingegneria",11
74.90.93,"Altre attivit di consulenza tecnica nca",11
62.09.01,"Configurazione di personal computer",10